[
  {
    "场景ID": "SCN-G02-00",
    "场景名称": "垃圾雨之前",
    "地点": "拾光号外部/降落航线",
    "场景类型": "序章导航",
    "角色": "星宇、七码",
    "核心目标": "躲避碎片并扫描封存脉冲",
    "下一场景": "SCN-G02-01",
    "存档点": "AUTO-G02-001",
    "关键道具": "无",
    "危险ID": "DANGER-004",
    "UI引用": "UI-005"
  },
  {
    "场景ID": "SCN-G02-01",
    "场景名称": "五尾清算",
    "地点": "屏幕谷外圈",
    "场景类型": "救援与规则暴露",
    "角色": "星宇、七码、阿铆、狰",
    "核心目标": "救下阿铆并识别资源标记",
    "下一场景": "SCN-G02-02",
    "存档点": "AUTO-G02-002",
    "关键道具": "磁力挂索",
    "危险ID": "DANGER-002",
    "UI引用": "UI-005/UI-006"
  },
  {
    "场景ID": "SCN-G02-02",
    "场景名称": "谁说这是无主之物",
    "地点": "旧电视墙",
    "场景类型": "找物与档案修复",
    "角色": "星宇、七码、阿铆",
    "核心目标": "恢复借用规则记录",
    "下一场景": "SCN-G02-03A/B/C/D",
    "存档点": "AUTO-G02-003",
    "关键道具": "短线、电源键",
    "危险ID": "DANGER-001",
    "UI引用": "UI-007/UI-010/UI-014"
  },
  {
    "场景ID": "SCN-G02-03A",
    "场景名称": "发动机坑",
    "地点": "飞船发动机坑",
    "场景类型": "能源拆解",
    "角色": "星宇、七码",
    "核心目标": "取得5格稳定芯与7格波动芯",
    "下一场景": "SCN-G02-04",
    "存档点": "AUTO-G02-004A",
    "关键道具": "小扳手、冷却片",
    "危险ID": "DANGER-002/DANGER-003",
    "UI引用": "UI-014"
  },
  {
    "场景ID": "SCN-G02-03B",
    "场景名称": "电池洞穴",
    "地点": "电池洞穴与冷却管网",
    "场景类型": "环境规避与找物",
    "角色": "星宇、七码",
    "核心目标": "取得5格稳定芯和保险丝",
    "下一场景": "SCN-G02-04",
    "存档点": "AUTO-G02-004B",
    "关键道具": "镜面屏片",
    "危险ID": "DANGER-003",
    "UI引用": "UI-015"
  },
  {
    "场景ID": "SCN-G02-03C",
    "场景名称": "供暖棚",
    "地点": "外环居住区",
    "场景类型": "伦理选择与替代方案",
    "角色": "星宇、七码、居民、阿铆",
    "核心目标": "建立临时供暖并登记借用8格核心",
    "下一场景": "SCN-G02-04",
    "存档点": "AUTO-G02-004C",
    "关键道具": "导热管、旧风扇",
    "危险ID": "DANGER-006",
    "UI引用": "UI-013/UI-006"
  },
  {
    "场景ID": "SCN-G02-03D",
    "场景名称": "电线森林",
    "地点": "电线森林与五塔外环",
    "场景类型": "路径调度",
    "角色": "星宇、七码、小线球",
    "核心目标": "找到短而安全的导线路线",
    "下一场景": "SCN-G02-04",
    "存档点": "AUTO-G02-004D",
    "关键道具": "绝缘键帽板",
    "危险ID": "DANGER-001",
    "UI引用": "UI-015"
  },
  {
    "场景ID": "SCN-G02-04",
    "场景名称": "磁力手套工坊",
    "地点": "阿铆工坊",
    "场景类型": "工具组装与诊断",
    "角色": "星宇、七码、阿铆",
    "核心目标": "组装磁力手套并纠正极性",
    "下一场景": "SCN-G02-05",
    "存档点": "AUTO-G02-005",
    "关键道具": "磁芯、皮手套、铜线",
    "危险ID": "DANGER-004",
    "UI引用": "UI-011/UI-014"
  },
  {
    "场景ID": "SCN-G02-05",
    "场景名称": "豆包不是第五块电池",
    "地点": "工坊内室",
    "场景类型": "情绪调查与方案发现",
    "角色": "星宇、七码、豆包、阿铆",
    "核心目标": "发现可中止备用电方案",
    "下一场景": "SCN-G02-06",
    "存档点": "AUTO-G02-006",
    "关键道具": "旧电容、备用电接口",
    "危险ID": "无",
    "UI引用": "UI-006/UI-010"
  },
  {
    "场景ID": "SCN-G02-06",
    "场景名称": "管理员权限解除",
    "地点": "中央星门平台与五塔",
    "场景类型": "综合机制与权限核验",
    "角色": "星宇、七码、阿铆、豆包、居民、狰",
    "核心目标": "完成五路供能、归属登记、授权开启与12秒稳定",
    "下一场景": "SCN-G02-07",
    "存档点": "AUTO-G02-007",
    "关键道具": "全部关键能源与工具",
    "危险ID": "DANGER-001/005/006",
    "UI引用": "UI-013/UI-015/UI-060"
  },
  {
    "场景ID": "SCN-G02-07",
    "场景名称": "把东西还回去",
    "地点": "屏幕谷/供暖棚/工坊",
    "场景类型": "回访与世界改变",
    "角色": "星宇、七码、阿铆、豆包、居民、狰",
    "核心目标": "归还借用资源并完成章节结算",
    "下一场景": "G03",
    "存档点": "AUTO-G02-008",
    "关键道具": "借用物归还",
    "危险ID": "无",
    "UI引用": "UI-061"
  }
]