[
  {
    "场景ID": "SCN-G08-00",
    "场景名称": "错过的第一秒",
    "地点": "停摆车站",
    "场景类型": "入场调查",
    "角色": "星宇、七码、钟匠秒秒、记录员回回、门卫相位、烛九阴",
    "核心目标": "完成错过的第一秒的调查、找物、机制或权限目标",
    "下一场景": "SCN-G08-01",
    "存档点": "AUTO-G08-001",
    "关键道具": "周期记录卡",
    "危险ID": "DANGER-038",
    "UI引用": "UI-036"
  },
  {
    "场景ID": "SCN-G08-01",
    "场景名称": "三钟广场",
    "地点": "三钟广场",
    "场景类型": "机制推进",
    "角色": "星宇、七码、钟匠秒秒、记录员回回、门卫相位、烛九阴",
    "核心目标": "完成三钟广场的调查、找物、机制或权限目标",
    "下一场景": "SCN-G08-02",
    "存档点": "AUTO-G08-002",
    "关键道具": "相位针",
    "危险ID": "DANGER-039",
    "UI引用": "UI-036"
  },
  {
    "场景ID": "SCN-G08-02",
    "场景名称": "行动窗口塔",
    "地点": "窗口调度塔",
    "场景类型": "找物与机制",
    "角色": "星宇、七码、钟匠秒秒、记录员回回、门卫相位、烛九阴",
    "核心目标": "完成行动窗口塔的调查、找物、机制或权限目标",
    "下一场景": "SCN-G08-03",
    "存档点": "AUTO-G08-003",
    "关键道具": "动作卡组",
    "危险ID": "DANGER-040",
    "UI引用": "UI-037"
  },
  {
    "场景ID": "SCN-G08-03",
    "场景名称": "循环档案室",
    "地点": "循环档案室",
    "场景类型": "机制推进",
    "角色": "星宇、七码、钟匠秒秒、记录员回回、门卫相位、烛九阴",
    "核心目标": "完成循环档案室的调查、找物、机制或权限目标",
    "下一场景": "SCN-G08-04",
    "存档点": "AUTO-G08-004",
    "关键道具": "窗口尺",
    "危险ID": "DANGER-041",
    "UI引用": "UI-037"
  },
  {
    "场景ID": "SCN-G08-04",
    "场景名称": "相位门阵",
    "地点": "相位门廊",
    "场景类型": "找物与机制",
    "角色": "星宇、七码、钟匠秒秒、记录员回回、门卫相位、烛九阴",
    "核心目标": "完成相位门阵的调查、找物、机制或权限目标",
    "下一场景": "SCN-G08-05",
    "存档点": "AUTO-G08-005",
    "关键道具": "循环日志芯",
    "危险ID": "DANGER-042",
    "UI引用": "UI-038"
  },
  {
    "场景ID": "SCN-G08-05",
    "场景名称": "第七次循环",
    "地点": "中央循环区",
    "场景类型": "剧情性失败/修正",
    "角色": "星宇、七码、钟匠秒秒、记录员回回、门卫相位、烛九阴",
    "核心目标": "完成第七次循环的调查、找物、机制或权限目标",
    "下一场景": "SCN-G08-06",
    "存档点": "AUTO-G08-006",
    "关键道具": "证据保留槽",
    "危险ID": "DANGER-043",
    "UI引用": "UI-038"
  },
  {
    "场景ID": "SCN-G08-06",
    "场景名称": "同步维修",
    "地点": "钟塔机房",
    "场景类型": "机制推进",
    "角色": "星宇、七码、钟匠秒秒、记录员回回、门卫相位、烛九阴",
    "核心目标": "完成同步维修的调查、找物、机制或权限目标",
    "下一场景": "SCN-G08-07",
    "存档点": "AUTO-G08-007",
    "关键道具": "相位钥",
    "危险ID": "DANGER-043",
    "UI引用": "UI-039"
  },
  {
    "场景ID": "SCN-G08-07",
    "场景名称": "烛九阴权限解除",
    "地点": "时间控制塔",
    "场景类型": "管理员权限解除",
    "角色": "星宇、七码、钟匠秒秒、记录员回回、门卫相位、烛九阴",
    "核心目标": "完成烛九阴权限解除的调查、找物、机制或权限目标",
    "下一场景": "SCN-G08-08",
    "存档点": "AUTO-G08-008",
    "关键道具": "摆锤配重",
    "危险ID": "DANGER-041/DANGER-042/DANGER-043",
    "UI引用": "UI-072"
  },
  {
    "场景ID": "SCN-G08-08",
    "场景名称": "时间恢复",
    "地点": "城市主钟",
    "场景类型": "世界改变/回访",
    "角色": "星宇、七码、钟匠秒秒、记录员回回、门卫相位、烛九阴",
    "核心目标": "完成时间恢复的调查、找物、机制或权限目标",
    "下一场景": "SCN-G08-09",
    "存档点": "AUTO-G08-009",
    "关键道具": "同步齿轮",
    "危险ID": "无",
    "UI引用": "UI-073"
  },
  {
    "场景ID": "SCN-G08-09",
    "场景名称": "回访与结算",
    "地点": "档案回廊",
    "场景类型": "世界改变/回访",
    "角色": "星宇、七码、钟匠秒秒、记录员回回、门卫相位、烛九阴",
    "核心目标": "完成回访与结算的调查、找物、机制或权限目标",
    "下一场景": "G09",
    "存档点": "AUTO-G08-010",
    "关键道具": "时间锚",
    "危险ID": "无",
    "UI引用": "UI-073"
  }
]