[
  {
    "场景ID": "SCN-G13-00",
    "场景名称": "回到零号地球",
    "地点": "地球轨道站",
    "场景类型": "入场调查",
    "角色": "星宇、七码、十二星管理员记录、文明样本代表、零号管理员",
    "核心目标": "完成回到零号地球的调查、找物、机制或权限目标",
    "下一场景": "SCN-G13-01",
    "存档点": "AUTO-G13-001",
    "关键道具": "十二星数据片",
    "危险ID": "DANGER-068",
    "UI引用": "UI-056"
  },
  {
    "场景ID": "SCN-G13-01",
    "场景名称": "十二星数据环",
    "地点": "十二星数据厅",
    "场景类型": "机制推进",
    "角色": "星宇、七码、十二星管理员记录、文明样本代表、零号管理员",
    "核心目标": "完成十二星数据环的调查、找物、机制或权限目标",
    "下一场景": "SCN-G13-02",
    "存档点": "AUTO-G13-002",
    "关键道具": "依赖连接线",
    "危险ID": "DANGER-069",
    "UI引用": "UI-056"
  },
  {
    "场景ID": "SCN-G13-02",
    "场景名称": "文明样本库",
    "地点": "文明样本库",
    "场景类型": "找物与机制",
    "角色": "星宇、七码、十二星管理员记录、文明样本代表、零号管理员",
    "核心目标": "完成文明样本库的调查、找物、机制或权限目标",
    "下一场景": "SCN-G13-03",
    "存档点": "AUTO-G13-003",
    "关键道具": "文明样本卡",
    "危险ID": "DANGER-070",
    "UI引用": "UI-057"
  },
  {
    "场景ID": "SCN-G13-03",
    "场景名称": "唤醒批次",
    "地点": "生态准备舱",
    "场景类型": "机制推进",
    "角色": "星宇、七码、十二星管理员记录、文明样本代表、零号管理员",
    "核心目标": "完成唤醒批次的调查、找物、机制或权限目标",
    "下一场景": "SCN-G13-04",
    "存档点": "AUTO-G13-004",
    "关键道具": "环境阈值牌",
    "危险ID": "DANGER-071",
    "UI引用": "UI-057"
  },
  {
    "场景ID": "SCN-G13-04",
    "场景名称": "历史档案井",
    "地点": "历史档案井",
    "场景类型": "找物与机制",
    "角色": "星宇、七码、十二星管理员记录、文明样本代表、零号管理员",
    "核心目标": "完成历史档案井的调查、找物、机制或权限目标",
    "下一场景": "SCN-G13-05",
    "存档点": "AUTO-G13-005",
    "关键道具": "批次时间片",
    "危险ID": "DANGER-072",
    "UI引用": "UI-058"
  },
  {
    "场景ID": "SCN-G13-05",
    "场景名称": "真相拼合",
    "地点": "真相时间线",
    "场景类型": "剧情性失败/修正",
    "角色": "星宇、七码、十二星管理员记录、文明样本代表、零号管理员",
    "核心目标": "完成真相拼合的调查、找物、机制或权限目标",
    "下一场景": "SCN-G13-06",
    "存档点": "AUTO-G13-006",
    "关键道具": "历史档案碎片",
    "危险ID": "DANGER-073",
    "UI引用": "UI-058"
  },
  {
    "场景ID": "SCN-G13-06",
    "场景名称": "旧核心手动维修",
    "地点": "旧核心机房",
    "场景类型": "机制推进",
    "角色": "星宇、七码、十二星管理员记录、文明样本代表、零号管理员",
    "核心目标": "完成旧核心手动维修的调查、找物、机制或权限目标",
    "下一场景": "SCN-G13-07",
    "存档点": "AUTO-G13-007",
    "关键道具": "来源印记",
    "危险ID": "DANGER-074",
    "UI引用": "UI-059"
  },
  {
    "场景ID": "SCN-G13-07",
    "场景名称": "最终权限解除",
    "地点": "零号控制室",
    "场景类型": "管理员权限解除",
    "角色": "星宇、七码、十二星管理员记录、文明样本代表、零号管理员",
    "核心目标": "完成最终权限解除的调查、找物、机制或权限目标",
    "下一场景": "SCN-G13-08",
    "存档点": "AUTO-G13-008",
    "关键道具": "小扳手",
    "危险ID": "DANGER-074/DANGER-075/DANGER-076",
    "UI引用": "UI-082"
  },
  {
    "场景ID": "SCN-G13-08",
    "场景名称": "结局选择",
    "地点": "地表观察台",
    "场景类型": "世界改变/回访",
    "角色": "星宇、七码、十二星管理员记录、文明样本代表、零号管理员",
    "核心目标": "完成结局选择的调查、找物、机制或权限目标",
    "下一场景": "SCN-G13-09",
    "存档点": "AUTO-G13-009",
    "关键道具": "旧式螺母",
    "危险ID": "无",
    "UI引用": "UI-083"
  },
  {
    "场景ID": "SCN-G13-09",
    "场景名称": "全章回顾",
    "地点": "星图回顾厅",
    "场景类型": "世界改变/回访",
    "角色": "星宇、七码、十二星管理员记录、文明样本代表、零号管理员",
    "核心目标": "完成全章回顾的调查、找物、机制或权限目标",
    "下一场景": "END",
    "存档点": "AUTO-G13-010",
    "关键道具": "力度刻度片",
    "危险ID": "无",
    "UI引用": "UI-083"
  }
]