[
  {
    "场景ID": "SCN-G05-00",
    "场景名称": "两条高度线",
    "地点": "镜像冻层降落区",
    "场景类型": "入场校准",
    "角色": "星宇、七码、米米",
    "核心目标": "辨认38米/83米假读数并安全降落",
    "下一场景": "SCN-G05-01",
    "存档点": "AUTO-G05-001",
    "关键道具": "棱镜扫描镜、激光测距仪",
    "危险ID": "DANGER-020",
    "UI引用": "UI-024"
  },
  {
    "场景ID": "SCN-G05-01",
    "场景名称": "会变长的尺林",
    "地点": "动态冰柱尺林",
    "场景类型": "标准调查",
    "角色": "星宇、七码、米米",
    "核心目标": "建立当前温度下的临时测量标准",
    "下一场景": "SCN-G05-02",
    "存档点": "AUTO-G05-002",
    "关键道具": "基准杆、温度贴",
    "危险ID": "DANGER-021",
    "UI引用": "UI-024/UI-026"
  },
  {
    "场景ID": "SCN-G05-02",
    "场景名称": "量杯站上涨",
    "地点": "透明融水站",
    "场景类型": "容量救援",
    "角色": "星宇、七码、升升",
    "核心目标": "分配融水并保持最低安全余量",
    "下一场景": "SCN-G05-03",
    "存档点": "AUTO-G05-003",
    "关键道具": "量杯组、排水阀柄",
    "危险ID": "DANGER-022",
    "UI引用": "UI-025"
  },
  {
    "场景ID": "SCN-G05-03",
    "场景名称": "第一次冰桥失败",
    "地点": "旧冰桥口",
    "场景类型": "失败反转",
    "角色": "星宇、七码、米米",
    "核心目标": "因单次读数和冲动铺桥造成桥头错位",
    "下一场景": "SCN-G05-04",
    "存档点": "AUTO-G05-004",
    "关键道具": "桥板、激光测距仪",
    "危险ID": "DANGER-023",
    "UI引用": "UI-026"
  },
  {
    "场景ID": "SCN-G05-04",
    "场景名称": "坠入冰缝",
    "地点": "闭合冰缝",
    "场景类型": "安全路线",
    "角色": "星宇、七码、米米、秤砣叔",
    "核心目标": "依据厚度、压力和步距规划撤离路线",
    "下一场景": "SCN-G05-05",
    "存档点": "AUTO-G05-005",
    "关键道具": "厚度探针、配重袋、安全绳",
    "危险ID": "DANGER-024",
    "UI引用": "UI-027"
  },
  {
    "场景ID": "SCN-G05-05",
    "场景名称": "一座会呼吸的桥",
    "地点": "滑轨桥施工区",
    "场景类型": "工程修复",
    "角色": "星宇、七码、米米、秤砣叔、滴答",
    "核心目标": "用误差带和伸缩余量完成滑轨桥",
    "下一场景": "SCN-G05-06",
    "存档点": "AUTO-G05-006",
    "关键道具": "滑轨、伸缩扣、配重块",
    "危险ID": "DANGER-025",
    "UI引用": "UI-026/UI-027"
  },
  {
    "场景ID": "SCN-G05-06",
    "场景名称": "冰夷权限解除",
    "地点": "冰龙风切控制台",
    "场景类型": "管理员核验",
    "角色": "星宇、七码、米米、升升、滴答、冰夷",
    "核心目标": "提交校准、供水、测量和安全路线结果",
    "下一场景": "SCN-G05-07",
    "存档点": "AUTO-G05-007",
    "关键道具": "全部关键证据",
    "危险ID": "DANGER-020/022/025",
    "UI引用": "UI-066"
  },
  {
    "场景ID": "SCN-G05-07",
    "场景名称": "答案后面写当前",
    "地点": "冰原主桥与居民区",
    "场景类型": "世界改变",
    "角色": "星宇、七码、居民、冰夷",
    "核心目标": "提交“当前值＋误差范围＋复测周期”并恢复通行",
    "下一场景": "SCN-G05-08",
    "存档点": "AUTO-G05-008",
    "关键道具": "动态测量报告",
    "危险ID": "无",
    "UI引用": "UI-067"
  },
  {
    "场景ID": "SCN-G05-08",
    "场景名称": "归还与回访",
    "地点": "尺林/量杯站/滑轨桥",
    "场景类型": "回访结算",
    "角色": "星宇、七码、米米、升升、冰夷",
    "核心目标": "验证标准更新、供水恢复和桥梁安全",
    "下一场景": "G06",
    "存档点": "AUTO-G05-009",
    "关键道具": "借用工具归还",
    "危险ID": "无",
    "UI引用": "UI-067"
  }
]
