[
  {
    "场景ID": "SCN-G04-00",
    "场景名称": "左右失控的降落",
    "地点": "镜面沙海外缘",
    "场景类型": "入场导航",
    "角色": "星宇、七码",
    "核心目标": "校准镜像导航并找到真实落点",
    "下一场景": "SCN-G04-01",
    "存档点": "AUTO-G04-001",
    "关键道具": "镜面屏片",
    "危险ID": "DANGER-014",
    "UI引用": "UI-005/UI-020"
  },
  {
    "场景ID": "SCN-G04-01",
    "场景名称": "会说谎的路标",
    "地点": "双向路标林",
    "场景类型": "坐标调查",
    "角色": "星宇、七码、沙旅人",
    "核心目标": "识别现实层与镜像层坐标差异",
    "下一场景": "SCN-G04-02",
    "存档点": "AUTO-G04-002",
    "关键道具": "坐标针、真向标",
    "危险ID": "DANGER-015",
    "UI引用": "UI-020"
  },
  {
    "场景ID": "SCN-G04-02",
    "场景名称": "碎掉的记忆井",
    "地点": "记忆井遗址",
    "场景类型": "找物与证据",
    "角色": "星宇、七码、阿镜",
    "核心目标": "收集并验证第一组记忆碎片",
    "下一场景": "SCN-G04-03",
    "存档点": "AUTO-G04-003",
    "关键道具": "记忆碎片、来源标签",
    "危险ID": "DANGER-016",
    "UI引用": "UI-021"
  },
  {
    "场景ID": "SCN-G04-03",
    "场景名称": "反着开的门",
    "地点": "反向输入门阵",
    "场景类型": "机制解谜",
    "角色": "星宇、七码",
    "核心目标": "通过单步测试识别反向输入规则",
    "下一场景": "SCN-G04-04",
    "存档点": "AUTO-G04-004",
    "关键道具": "测试片、方向键",
    "危险ID": "DANGER-017",
    "UI引用": "UI-022"
  },
  {
    "场景ID": "SCN-G04-04",
    "场景名称": "诱饵峡谷",
    "地点": "棱镜峡谷",
    "场景类型": "环境窗口与找物",
    "角色": "星宇、七码、阿镜",
    "核心目标": "从诱饵中识别真实目标并穿越峡谷",
    "下一场景": "SCN-G04-05",
    "存档点": "AUTO-G04-005",
    "关键道具": "验证标记、反光布",
    "危险ID": "DANGER-018",
    "UI引用": "UI-023"
  },
  {
    "场景ID": "SCN-G04-05",
    "场景名称": "镜像档案馆",
    "地点": "旧档案馆",
    "场景类型": "证据拼合",
    "角色": "星宇、七码、沙旅人",
    "核心目标": "恢复记忆来源并标记矛盾片段",
    "下一场景": "SCN-G04-06",
    "存档点": "AUTO-G04-006",
    "关键道具": "档案页、时间签",
    "危险ID": "DANGER-019",
    "UI引用": "UI-010/UI-021"
  },
  {
    "场景ID": "SCN-G04-06",
    "场景名称": "真假入口预测",
    "地点": "沙海核心外环",
    "场景类型": "机制推理",
    "角色": "星宇、七码、阿镜",
    "核心目标": "根据历史诱饵规律预测真实入口",
    "下一场景": "SCN-G04-07",
    "存档点": "AUTO-G04-007",
    "关键道具": "案例卡、验证标记",
    "危险ID": "DANGER-018",
    "UI引用": "UI-023"
  },
  {
    "场景ID": "SCN-G04-07",
    "场景名称": "管理员权限解除",
    "地点": "九尾狐镜塔",
    "场景类型": "综合权限核验",
    "角色": "星宇、七码、阿镜、九尾狐",
    "核心目标": "以真实坐标、固定记忆、反向规则和预测结果解除权限",
    "下一场景": "SCN-G04-08",
    "存档点": "AUTO-G04-008",
    "关键道具": "全部关键证据",
    "危险ID": "DANGER-015/017/019",
    "UI引用": "UI-064"
  },
  {
    "场景ID": "SCN-G04-08",
    "场景名称": "假入口消退",
    "地点": "镜面沙海主城",
    "场景类型": "世界改变",
    "角色": "星宇、七码、居民、九尾狐",
    "核心目标": "验证路径恢复、记忆固定和档案纠错",
    "下一场景": "SCN-G04-09",
    "存档点": "AUTO-G04-009",
    "关键道具": "无",
    "危险ID": "无",
    "UI引用": "UI-065"
  },
  {
    "场景ID": "SCN-G04-09",
    "场景名称": "真相回访与结算",
    "地点": "记忆井/档案馆/镜塔",
    "场景类型": "回访结算",
    "角色": "星宇、七码、阿镜、九尾狐",
    "核心目标": "完成回访并解锁G05",
    "下一场景": "G05",
    "存档点": "AUTO-G04-010",
    "关键道具": "借用物归还",
    "危险ID": "无",
    "UI引用": "UI-065"
  }
]
