[
  {
    "场景ID": "SCN-G07-00",
    "场景名称": "错位城门",
    "地点": "方格城外门",
    "场景类型": "入场调查",
    "角色": "星宇、七码、规划员格格、居民小隅、结构师三角叔、夔",
    "核心目标": "完成错位城门的调查、找物、机制或权限目标",
    "下一场景": "SCN-G07-01",
    "存档点": "AUTO-G07-001",
    "关键道具": "模块图纸",
    "危险ID": "DANGER-032",
    "UI引用": "UI-032"
  },
  {
    "场景ID": "SCN-G07-01",
    "场景名称": "一格移动广场",
    "地点": "模块广场",
    "场景类型": "机制推进",
    "角色": "星宇、七码、规划员格格、居民小隅、结构师三角叔、夔",
    "核心目标": "完成一格移动广场的调查、找物、机制或权限目标",
    "下一场景": "SCN-G07-02",
    "存档点": "AUTO-G07-002",
    "关键道具": "空格标记",
    "危险ID": "DANGER-033",
    "UI引用": "UI-032"
  },
  {
    "场景ID": "SCN-G07-02",
    "场景名称": "最后一块空地",
    "地点": "城市规划厅",
    "场景类型": "找物与机制",
    "角色": "星宇、七码、规划员格格、居民小隅、结构师三角叔、夔",
    "核心目标": "完成最后一块空地的调查、找物、机制或权限目标",
    "下一场景": "SCN-G07-03",
    "存档点": "AUTO-G07-003",
    "关键道具": "公共通道牌",
    "危险ID": "DANGER-034",
    "UI引用": "UI-033"
  },
  {
    "场景ID": "SCN-G07-03",
    "场景名称": "公共通道争议",
    "地点": "居民巷道",
    "场景类型": "机制推进",
    "角色": "星宇、七码、规划员格格、居民小隅、结构师三角叔、夔",
    "核心目标": "完成公共通道争议的调查、找物、机制或权限目标",
    "下一场景": "SCN-G07-04",
    "存档点": "AUTO-G07-004",
    "关键道具": "应急空地旗",
    "危险ID": "DANGER-035",
    "UI引用": "UI-033"
  },
  {
    "场景ID": "SCN-G07-04",
    "场景名称": "封锁线测量",
    "地点": "震动边界区",
    "场景类型": "找物与机制",
    "角色": "星宇、七码、规划员格格、居民小隅、结构师三角叔、夔",
    "核心目标": "完成封锁线测量的调查、找物、机制或权限目标",
    "下一场景": "SCN-G07-05",
    "存档点": "AUTO-G07-005",
    "关键道具": "边界测绳",
    "危险ID": "DANGER-036",
    "UI引用": "UI-034"
  },
  {
    "场景ID": "SCN-G07-05",
    "场景名称": "震动重排",
    "地点": "重排核心",
    "场景类型": "剧情性失败/修正",
    "角色": "星宇、七码、规划员格格、居民小隅、结构师三角叔、夔",
    "核心目标": "完成震动重排的调查、找物、机制或权限目标",
    "下一场景": "SCN-G07-06",
    "存档点": "AUTO-G07-006",
    "关键道具": "封锁桩",
    "危险ID": "DANGER-037",
    "UI引用": "UI-034"
  },
  {
    "场景ID": "SCN-G07-06",
    "场景名称": "塔架加固",
    "地点": "中央塔架",
    "场景类型": "机制推进",
    "角色": "星宇、七码、规划员格格、居民小隅、结构师三角叔、夔",
    "核心目标": "完成塔架加固的调查、找物、机制或权限目标",
    "下一场景": "SCN-G07-07",
    "存档点": "AUTO-G07-007",
    "关键道具": "三角支撑杆",
    "危险ID": "DANGER-037",
    "UI引用": "UI-035"
  },
  {
    "场景ID": "SCN-G07-07",
    "场景名称": "夔权限解除",
    "地点": "地震控制塔",
    "场景类型": "管理员权限解除",
    "角色": "星宇、七码、规划员格格、居民小隅、结构师三角叔、夔",
    "核心目标": "完成夔权限解除的调查、找物、机制或权限目标",
    "下一场景": "SCN-G07-08",
    "存档点": "AUTO-G07-008",
    "关键道具": "节点扣",
    "危险ID": "DANGER-035/DANGER-036/DANGER-037",
    "UI引用": "UI-070"
  },
  {
    "场景ID": "SCN-G07-08",
    "场景名称": "城市恢复",
    "地点": "城市主轴",
    "场景类型": "世界改变/回访",
    "角色": "星宇、七码、规划员格格、居民小隅、结构师三角叔、夔",
    "核心目标": "完成城市恢复的调查、找物、机制或权限目标",
    "下一场景": "SCN-G07-09",
    "存档点": "AUTO-G07-009",
    "关键道具": "震动记录器",
    "危险ID": "无",
    "UI引用": "UI-071"
  },
  {
    "场景ID": "SCN-G07-09",
    "场景名称": "回访与结算",
    "地点": "公共空地",
    "场景类型": "世界改变/回访",
    "角色": "星宇、七码、规划员格格、居民小隅、结构师三角叔、夔",
    "核心目标": "完成回访与结算的调查、找物、机制或权限目标",
    "下一场景": "G08",
    "存档点": "AUTO-G07-010",
    "关键道具": "塔架铆钉",
    "危险ID": "无",
    "UI引用": "UI-071"
  }
]