[
  {
    "场景ID": "SCN-G06-00",
    "场景名称": "风暴散落的航图",
    "地点": "漂浮码头",
    "场景类型": "入场调查",
    "角色": "星宇、七码、岛民阿澜、桥匠榫榫、能源员蓝罐、共工",
    "核心目标": "完成风暴散落的航图的调查、找物、机制或权限目标",
    "下一场景": "SCN-G06-01",
    "存档点": "AUTO-G06-001",
    "关键道具": "航图碎片",
    "危险ID": "DANGER-026",
    "UI引用": "UI-028"
  },
  {
    "场景ID": "SCN-G06-01",
    "场景名称": "九岛缺口调查",
    "地点": "九岛瞭望台",
    "场景类型": "机制推进",
    "角色": "星宇、七码、岛民阿澜、桥匠榫榫、能源员蓝罐、共工",
    "核心目标": "完成九岛缺口调查的调查、找物、机制或权限目标",
    "下一场景": "SCN-G06-02",
    "存档点": "AUTO-G06-002",
    "关键道具": "边缘编号片",
    "危险ID": "DANGER-027",
    "UI引用": "UI-028"
  },
  {
    "场景ID": "SCN-G06-02",
    "场景名称": "航线拼合台",
    "地点": "旧航图室",
    "场景类型": "找物与机制",
    "角色": "星宇、七码、岛民阿澜、桥匠榫榫、能源员蓝罐、共工",
    "核心目标": "完成航线拼合台的调查、找物、机制或权限目标",
    "下一场景": "SCN-G06-03",
    "存档点": "AUTO-G06-003",
    "关键道具": "缺口报告",
    "危险ID": "DANGER-028",
    "UI引用": "UI-029"
  },
  {
    "场景ID": "SCN-G06-03",
    "场景名称": "桥材比例工坊",
    "地点": "桥材切分场",
    "场景类型": "机制推进",
    "角色": "星宇、七码、岛民阿澜、桥匠榫榫、能源员蓝罐、共工",
    "核心目标": "完成桥材比例工坊的调查、找物、机制或权限目标",
    "下一场景": "SCN-G06-04",
    "存档点": "AUTO-G06-004",
    "关键道具": "桥材长尺",
    "危险ID": "DANGER-029",
    "UI引用": "UI-029"
  },
  {
    "场景ID": "SCN-G06-04",
    "场景名称": "能源罐站",
    "地点": "岛链能源站",
    "场景类型": "找物与机制",
    "角色": "星宇、七码、岛民阿澜、桥匠榫榫、能源员蓝罐、共工",
    "核心目标": "完成能源罐站的调查、找物、机制或权限目标",
    "下一场景": "SCN-G06-05",
    "存档点": "AUTO-G06-005",
    "关键道具": "分数切片",
    "危险ID": "DANGER-030",
    "UI引用": "UI-030"
  },
  {
    "场景ID": "SCN-G06-05",
    "场景名称": "断桥试搭失败",
    "地点": "南三岛断口",
    "场景类型": "剧情性失败/修正",
    "角色": "星宇、七码、岛民阿澜、桥匠榫榫、能源员蓝罐、共工",
    "核心目标": "完成断桥试搭失败的调查、找物、机制或权限目标",
    "下一场景": "SCN-G06-06",
    "存档点": "AUTO-G06-006",
    "关键道具": "余料标签",
    "危险ID": "DANGER-031",
    "UI引用": "UI-030"
  },
  {
    "场景ID": "SCN-G06-06",
    "场景名称": "岛链同步维修",
    "地点": "中央接驳环",
    "场景类型": "机制推进",
    "角色": "星宇、七码、岛民阿澜、桥匠榫榫、能源员蓝罐、共工",
    "核心目标": "完成岛链同步维修的调查、找物、机制或权限目标",
    "下一场景": "SCN-G06-07",
    "存档点": "AUTO-G06-007",
    "关键道具": "能源罐",
    "危险ID": "DANGER-031",
    "UI引用": "UI-031"
  },
  {
    "场景ID": "SCN-G06-07",
    "场景名称": "共工权限解除",
    "地点": "风暴控制塔",
    "场景类型": "管理员权限解除",
    "角色": "星宇、七码、岛民阿澜、桥匠榫榫、能源员蓝罐、共工",
    "核心目标": "完成共工权限解除的调查、找物、机制或权限目标",
    "下一场景": "SCN-G06-08",
    "存档点": "AUTO-G06-008",
    "关键道具": "最低保障牌",
    "危险ID": "DANGER-029/DANGER-030/DANGER-031",
    "UI引用": "UI-068"
  },
  {
    "场景ID": "SCN-G06-08",
    "场景名称": "九岛重连",
    "地点": "九岛主航线",
    "场景类型": "世界改变/回访",
    "角色": "星宇、七码、岛民阿澜、桥匠榫榫、能源员蓝罐、共工",
    "核心目标": "完成九岛重连的调查、找物、机制或权限目标",
    "下一场景": "SCN-G06-09",
    "存档点": "AUTO-G06-009",
    "关键道具": "转接扣",
    "危险ID": "无",
    "UI引用": "UI-069"
  },
  {
    "场景ID": "SCN-G06-09",
    "场景名称": "回访与结算",
    "地点": "居民码头",
    "场景类型": "世界改变/回访",
    "角色": "星宇、七码、岛民阿澜、桥匠榫榫、能源员蓝罐、共工",
    "核心目标": "完成回访与结算的调查、找物、机制或权限目标",
    "下一场景": "G07",
    "存档点": "AUTO-G06-010",
    "关键道具": "浮桥索",
    "危险ID": "无",
    "UI引用": "UI-069"
  }
]