[
  {
    "场景ID": "SCN-G11-00",
    "场景名称": "看得见却装不上",
    "地点": "工厂卸料口",
    "场景类型": "入场调查",
    "角色": "星宇、七码、装配师面面、仓线员箱箱、机械师臂叔、帝江",
    "核心目标": "完成看得见却装不上的调查、找物、机制或权限目标",
    "下一场景": "SCN-G11-01",
    "存档点": "AUTO-G11-001",
    "关键道具": "三视图卡组",
    "危险ID": "DANGER-056",
    "UI引用": "UI-048"
  },
  {
    "场景ID": "SCN-G11-01",
    "场景名称": "三视图车间",
    "地点": "三视图车间",
    "场景类型": "机制推进",
    "角色": "星宇、七码、装配师面面、仓线员箱箱、机械师臂叔、帝江",
    "核心目标": "完成三视图车间的调查、找物、机制或权限目标",
    "下一场景": "SCN-G11-02",
    "存档点": "AUTO-G11-002",
    "关键道具": "方向轴",
    "危险ID": "DANGER-057",
    "UI引用": "UI-048"
  },
  {
    "场景ID": "SCN-G11-02",
    "场景名称": "空间装箱线",
    "地点": "立体装箱线",
    "场景类型": "找物与机制",
    "角色": "星宇、七码、装配师面面、仓线员箱箱、机械师臂叔、帝江",
    "核心目标": "完成空间装箱线的调查、找物、机制或权限目标",
    "下一场景": "SCN-G11-03",
    "存档点": "AUTO-G11-003",
    "关键道具": "立体模块",
    "危险ID": "DANGER-058",
    "UI引用": "UI-049"
  },
  {
    "场景ID": "SCN-G11-03",
    "场景名称": "维护通道争议",
    "地点": "维护夹层",
    "场景类型": "机制推进",
    "角色": "星宇、七码、装配师面面、仓线员箱箱、机械师臂叔、帝江",
    "核心目标": "完成维护通道争议的调查、找物、机制或权限目标",
    "下一场景": "SCN-G11-04",
    "存档点": "AUTO-G11-004",
    "关键道具": "维护通道框",
    "危险ID": "DANGER-059",
    "UI引用": "UI-049"
  },
  {
    "场景ID": "SCN-G11-04",
    "场景名称": "受力分散阵",
    "地点": "护盾测试区",
    "场景类型": "找物与机制",
    "角色": "星宇、七码、装配师面面、仓线员箱箱、机械师臂叔、帝江",
    "核心目标": "完成受力分散阵的调查、找物、机制或权限目标",
    "下一场景": "SCN-G11-05",
    "存档点": "AUTO-G11-005",
    "关键道具": "体积标签",
    "危险ID": "DANGER-060",
    "UI引用": "UI-050"
  },
  {
    "场景ID": "SCN-G11-05",
    "场景名称": "机械臂碰撞",
    "地点": "机械臂管廊",
    "场景类型": "剧情性失败/修正",
    "角色": "星宇、七码、装配师面面、仓线员箱箱、机械师臂叔、帝江",
    "核心目标": "完成机械臂碰撞的调查、找物、机制或权限目标",
    "下一场景": "SCN-G11-06",
    "存档点": "AUTO-G11-006",
    "关键道具": "受力箭头片",
    "危险ID": "DANGER-061",
    "UI引用": "UI-050"
  },
  {
    "场景ID": "SCN-G11-06",
    "场景名称": "关节避障维修",
    "地点": "维修平台",
    "场景类型": "机制推进",
    "角色": "星宇、七码、装配师面面、仓线员箱箱、机械师臂叔、帝江",
    "核心目标": "完成关节避障维修的调查、找物、机制或权限目标",
    "下一场景": "SCN-G11-07",
    "存档点": "AUTO-G11-007",
    "关键道具": "护盾面板",
    "危险ID": "DANGER-061",
    "UI引用": "UI-051"
  },
  {
    "场景ID": "SCN-G11-07",
    "场景名称": "帝江权限解除",
    "地点": "帝江控制室",
    "场景类型": "管理员权限解除",
    "角色": "星宇、七码、装配师面面、仓线员箱箱、机械师臂叔、帝江",
    "核心目标": "完成帝江权限解除的调查、找物、机制或权限目标",
    "下一场景": "SCN-G11-08",
    "存档点": "AUTO-G11-008",
    "关键道具": "关节动作卡",
    "危险ID": "DANGER-059/DANGER-060/DANGER-061",
    "UI引用": "UI-078"
  },
  {
    "场景ID": "SCN-G11-08",
    "场景名称": "工厂恢复",
    "地点": "生产主线",
    "场景类型": "世界改变/回访",
    "角色": "星宇、七码、装配师面面、仓线员箱箱、机械师臂叔、帝江",
    "核心目标": "完成工厂恢复的调查、找物、机制或权限目标",
    "下一场景": "SCN-G11-09",
    "存档点": "AUTO-G11-009",
    "关键道具": "姿态夹",
    "危险ID": "无",
    "UI引用": "UI-079"
  },
  {
    "场景ID": "SCN-G11-09",
    "场景名称": "回访与结算",
    "地点": "工程档案台",
    "场景类型": "世界改变/回访",
    "角色": "星宇、七码、装配师面面、仓线员箱箱、机械师臂叔、帝江",
    "核心目标": "完成回访与结算的调查、找物、机制或权限目标",
    "下一场景": "G12",
    "存档点": "AUTO-G11-010",
    "关键道具": "碰撞探针",
    "危险ID": "无",
    "UI引用": "UI-079"
  }
]