[
  {
    "场景ID": "SCN-G01-00",
    "场景名称": "拾光号熄灯",
    "地点": "拾光号维修舱",
    "场景类型": "序章开场/基础调查",
    "角色": "星宇、七码（离线）",
    "核心目标": "恢复应急照明并确认故障不是普通断电",
    "下一场景": "SCN-G01-01",
    "存档点": "AUTO-G01-001",
    "关键道具": "应急手灯、旧扳手",
    "危险ID": "DANGER-G01-001",
    "UI引用": "UI-005/UI-008"
  },
  {
    "场景ID": "SCN-G01-01",
    "场景名称": "找回七码",
    "地点": "导航核心舱",
    "场景类型": "找物与组合教学",
    "角色": "星宇、七码",
    "核心目标": "找到保险丝、接线片和八码芯片，恢复七码",
    "下一场景": "SCN-G01-02",
    "存档点": "AUTO-G01-002",
    "关键道具": "保险丝、接线片、七码芯片",
    "危险ID": "DANGER-G01-001",
    "UI引用": "UI-006/UI-007"
  },
  {
    "场景ID": "SCN-G01-02",
    "场景名称": "船上第一张任务单",
    "地点": "拾光号中控台",
    "场景类型": "任务/日志/地图教学",
    "角色": "星宇、七码",
    "核心目标": "读取维修清单并建立首个任务链",
    "下一场景": "SCN-G01-03",
    "存档点": "AUTO-G01-003",
    "关键道具": "维修清单、星图钥片",
    "危险ID": "无",
    "UI引用": "UI-008/UI-009"
  },
  {
    "场景ID": "SCN-G01-03",
    "场景名称": "漏气的货舱",
    "地点": "拾光号货舱",
    "场景类型": "环境危险与软失败教学",
    "角色": "星宇、七码",
    "核心目标": "在氧压下降前封闭裂口并恢复货舱气密",
    "下一场景": "SCN-G01-04",
    "存档点": "AUTO-G01-004",
    "关键道具": "密封胶带、补片、压力表",
    "危险ID": "DANGER-G01-002",
    "UI引用": "UI-005/UI-012"
  },
  {
    "场景ID": "SCN-G01-04",
    "场景名称": "星图缺口",
    "地点": "导航星图室",
    "场景类型": "教学机制/证据分析",
    "角色": "星宇、七码",
    "核心目标": "拼合星图碎片、确认十二星门异常并定位锈环星",
    "下一场景": "SCN-G01-05",
    "存档点": "AUTO-G01-005",
    "关键道具": "星图碎片、坐标标记",
    "危险ID": "DANGER-G01-003",
    "UI引用": "UI-010/UI-011"
  },
  {
    "场景ID": "SCN-G01-05",
    "场景名称": "垃圾雨航线",
    "地点": "拾光号驾驶舱与外部航线",
    "场景类型": "路径规划与安全节点教学",
    "角色": "星宇、七码",
    "核心目标": "规划垃圾雨安全航线并完成三段航行",
    "下一场景": "SCN-G01-06",
    "存档点": "AUTO-G01-006",
    "关键道具": "航线卡、推进器旁路片",
    "危险ID": "DANGER-G01-004",
    "UI引用": "UI-009/UI-005"
  },
  {
    "场景ID": "SCN-G01-06",
    "场景名称": "锈环星求救信号",
    "地点": "远距观测窗",
    "场景类型": "剧情确认/权限授权",
    "角色": "星宇、七码",
    "核心目标": "解析求救信号，授权七码搜寻、分析和寻路",
    "下一场景": "SCN-G01-07",
    "存档点": "AUTO-G01-007",
    "关键道具": "求救记录、能力授权片",
    "危险ID": "无",
    "UI引用": "UI-006/UI-010"
  },
  {
    "场景ID": "SCN-G01-07",
    "场景名称": "坠落之前",
    "地点": "锈环星近地轨道/落点",
    "场景类型": "序章结尾/章节交接",
    "角色": "星宇、七码",
    "核心目标": "扫描落点、完成自动存档并交接G02旧屏幕谷外缘",
    "下一场景": "G02",
    "存档点": "AUTO-G01-008",
    "关键道具": "落点扫描记录",
    "危险ID": "DANGER-G01-004",
    "UI引用": "UI-005/UI-061"
  }
]