[
  {
    "场景ID": "SCN-G10-00",
    "场景名称": "随机风降落",
    "地点": "云港外泊位",
    "场景类型": "入场调查",
    "角色": "星宇、七码、气象员云云、仓管箱叔、领航员岚岚、玄冥",
    "核心目标": "完成随机风降落的调查、找物、机制或权限目标",
    "下一场景": "SCN-G10-01",
    "存档点": "AUTO-G10-001",
    "关键道具": "风向样本卡",
    "危险ID": "DANGER-050",
    "UI引用": "UI-044"
  },
  {
    "场景ID": "SCN-G10-01",
    "场景名称": "风向样本墙",
    "地点": "气象墙",
    "场景类型": "机制推进",
    "角色": "星宇、七码、气象员云云、仓管箱叔、领航员岚岚、玄冥",
    "核心目标": "完成风向样本墙的调查、找物、机制或权限目标",
    "下一场景": "SCN-G10-02",
    "存档点": "AUTO-G10-002",
    "关键道具": "频率筹码",
    "危险ID": "DANGER-051",
    "UI引用": "UI-044"
  },
  {
    "场景ID": "SCN-G10-02",
    "场景名称": "货箱抽样",
    "地点": "货仓群",
    "场景类型": "找物与机制",
    "角色": "星宇、七码、气象员云云、仓管箱叔、领航员岚岚、玄冥",
    "核心目标": "完成货箱抽样的调查、找物、机制或权限目标",
    "下一场景": "SCN-G10-03",
    "存档点": "AUTO-G10-003",
    "关键道具": "抽样夹",
    "危险ID": "DANGER-052",
    "UI引用": "UI-045"
  },
  {
    "场景ID": "SCN-G10-03",
    "场景名称": "代表性争议",
    "地点": "抽样平台",
    "场景类型": "机制推进",
    "角色": "星宇、七码、气象员云云、仓管箱叔、领航员岚岚、玄冥",
    "核心目标": "完成代表性争议的调查、找物、机制或权限目标",
    "下一场景": "SCN-G10-04",
    "存档点": "AUTO-G10-004",
    "关键道具": "区域编号签",
    "危险ID": "DANGER-053",
    "UI引用": "UI-045"
  },
  {
    "场景ID": "SCN-G10-04",
    "场景名称": "概率门阵",
    "地点": "云门航道",
    "场景类型": "找物与机制",
    "角色": "星宇、七码、气象员云云、仓管箱叔、领航员岚岚、玄冥",
    "核心目标": "完成概率门阵的调查、找物、机制或权限目标",
    "下一场景": "SCN-G10-05",
    "存档点": "AUTO-G10-005",
    "关键道具": "问题货箱封条",
    "危险ID": "DANGER-054",
    "UI引用": "UI-046"
  },
  {
    "场景ID": "SCN-G10-05",
    "场景名称": "错误确定航线",
    "地点": "雷暴边缘",
    "场景类型": "剧情性失败/修正",
    "角色": "星宇、七码、气象员云云、仓管箱叔、领航员岚岚、玄冥",
    "核心目标": "完成错误确定航线的调查、找物、机制或权限目标",
    "下一场景": "SCN-G10-06",
    "存档点": "AUTO-G10-006",
    "关键道具": "概率环片",
    "危险ID": "DANGER-055",
    "UI引用": "UI-046"
  },
  {
    "场景ID": "SCN-G10-06",
    "场景名称": "天气决策板",
    "地点": "港务决策厅",
    "场景类型": "机制推进",
    "角色": "星宇、七码、气象员云云、仓管箱叔、领航员岚岚、玄冥",
    "核心目标": "完成天气决策板的调查、找物、机制或权限目标",
    "下一场景": "SCN-G10-07",
    "存档点": "AUTO-G10-007",
    "关键道具": "风险阈值牌",
    "危险ID": "DANGER-055",
    "UI引用": "UI-047"
  },
  {
    "场景ID": "SCN-G10-07",
    "场景名称": "玄冥权限解除",
    "地点": "玄冥塔",
    "场景类型": "管理员权限解除",
    "角色": "星宇、七码、气象员云云、仓管箱叔、领航员岚岚、玄冥",
    "核心目标": "完成玄冥权限解除的调查、找物、机制或权限目标",
    "下一场景": "SCN-G10-08",
    "存档点": "AUTO-G10-008",
    "关键道具": "天气证据卡",
    "危险ID": "DANGER-053/DANGER-054/DANGER-055",
    "UI引用": "UI-076"
  },
  {
    "场景ID": "SCN-G10-08",
    "场景名称": "云港恢复",
    "地点": "主航线",
    "场景类型": "世界改变/回访",
    "角色": "星宇、七码、气象员云云、仓管箱叔、领航员岚岚、玄冥",
    "核心目标": "完成云港恢复的调查、找物、机制或权限目标",
    "下一场景": "SCN-G10-09",
    "存档点": "AUTO-G10-009",
    "关键道具": "改道图",
    "危险ID": "无",
    "UI引用": "UI-077"
  },
  {
    "场景ID": "SCN-G10-09",
    "场景名称": "回访与结算",
    "地点": "货仓码头",
    "场景类型": "世界改变/回访",
    "角色": "星宇、七码、气象员云云、仓管箱叔、领航员岚岚、玄冥",
    "核心目标": "完成回访与结算的调查、找物、机制或权限目标",
    "下一场景": "G11",
    "存档点": "AUTO-G10-010",
    "关键道具": "雷暴计",
    "危险ID": "无",
    "UI引用": "UI-077"
  }
]