[
  {
    "场景ID": "SCN-G09-00",
    "场景名称": "翻面的降落盘",
    "地点": "卫星落点盘",
    "场景类型": "入场调查",
    "角色": "星宇、七码、棋手步步、档案员理理、双盘守卫映映、刑天",
    "核心目标": "完成翻面的降落盘的调查、找物、机制或权限目标",
    "下一场景": "SCN-G09-01",
    "存档点": "AUTO-G09-001",
    "关键道具": "坐标棋子",
    "危险ID": "DANGER-044",
    "UI引用": "UI-040"
  },
  {
    "场景ID": "SCN-G09-01",
    "场景名称": "坐标棋盘",
    "地点": "主棋盘广场",
    "场景类型": "机制推进",
    "角色": "星宇、七码、棋手步步、档案员理理、双盘守卫映映、刑天",
    "核心目标": "完成坐标棋盘的调查、找物、机制或权限目标",
    "下一场景": "SCN-G09-02",
    "存档点": "AUTO-G09-002",
    "关键道具": "翻转轴片",
    "危险ID": "DANGER-045",
    "UI引用": "UI-040"
  },
  {
    "场景ID": "SCN-G09-02",
    "场景名称": "能力推演厅",
    "地点": "棋子训练厅",
    "场景类型": "找物与机制",
    "角色": "星宇、七码、棋手步步、档案员理理、双盘守卫映映、刑天",
    "核心目标": "完成能力推演厅的调查、找物、机制或权限目标",
    "下一场景": "SCN-G09-03",
    "存档点": "AUTO-G09-003",
    "关键道具": "移动规则卡",
    "危险ID": "DANGER-046",
    "UI引用": "UI-041"
  },
  {
    "场景ID": "SCN-G09-03",
    "场景名称": "真假规则馆",
    "地点": "规则档案馆",
    "场景类型": "机制推进",
    "角色": "星宇、七码、棋手步步、档案员理理、双盘守卫映映、刑天",
    "核心目标": "完成真假规则馆的调查、找物、机制或权限目标",
    "下一场景": "SCN-G09-04",
    "存档点": "AUTO-G09-004",
    "关键道具": "路线标记",
    "危险ID": "DANGER-047",
    "UI引用": "UI-041"
  },
  {
    "场景ID": "SCN-G09-04",
    "场景名称": "双盘联动桥",
    "地点": "双盘联动桥",
    "场景类型": "找物与机制",
    "角色": "星宇、七码、棋手步步、档案员理理、双盘守卫映映、刑天",
    "核心目标": "完成双盘联动桥的调查、找物、机制或权限目标",
    "下一场景": "SCN-G09-05",
    "存档点": "AUTO-G09-005",
    "关键道具": "逻辑前提牌",
    "危险ID": "DANGER-048",
    "UI引用": "UI-042"
  },
  {
    "场景ID": "SCN-G09-05",
    "场景名称": "错误必胜路线",
    "地点": "禁区棋盘",
    "场景类型": "剧情性失败/修正",
    "角色": "星宇、七码、棋手步步、档案员理理、双盘守卫映映、刑天",
    "核心目标": "完成错误必胜路线的调查、找物、机制或权限目标",
    "下一场景": "SCN-G09-06",
    "存档点": "AUTO-G09-006",
    "关键道具": "结论牌",
    "危险ID": "DANGER-049",
    "UI引用": "UI-042"
  },
  {
    "场景ID": "SCN-G09-06",
    "场景名称": "同步解锁",
    "地点": "同步核心",
    "场景类型": "机制推进",
    "角色": "星宇、七码、棋手步步、档案员理理、双盘守卫映映、刑天",
    "核心目标": "完成同步解锁的调查、找物、机制或权限目标",
    "下一场景": "SCN-G09-07",
    "存档点": "AUTO-G09-007",
    "关键道具": "反例标记",
    "危险ID": "DANGER-049",
    "UI引用": "UI-043"
  },
  {
    "场景ID": "SCN-G09-07",
    "场景名称": "刑天权限解除",
    "地点": "刑天控制台",
    "场景类型": "管理员权限解除",
    "角色": "星宇、七码、棋手步步、档案员理理、双盘守卫映映、刑天",
    "核心目标": "完成刑天权限解除的调查、找物、机制或权限目标",
    "下一场景": "SCN-G09-08",
    "存档点": "AUTO-G09-008",
    "关键道具": "双盘映射片",
    "危险ID": "DANGER-047/DANGER-048/DANGER-049",
    "UI引用": "UI-074"
  },
  {
    "场景ID": "SCN-G09-08",
    "场景名称": "棋阵恢复",
    "地点": "卫星主轴",
    "场景类型": "世界改变/回访",
    "角色": "星宇、七码、棋手步步、档案员理理、双盘守卫映映、刑天",
    "核心目标": "完成棋阵恢复的调查、找物、机制或权限目标",
    "下一场景": "SCN-G09-09",
    "存档点": "AUTO-G09-009",
    "关键道具": "同步销",
    "危险ID": "无",
    "UI引用": "UI-075"
  },
  {
    "场景ID": "SCN-G09-09",
    "场景名称": "回访与结算",
    "地点": "规则广场",
    "场景类型": "世界改变/回访",
    "角色": "星宇、七码、棋手步步、档案员理理、双盘守卫映映、刑天",
    "核心目标": "完成回访与结算的调查、找物、机制或权限目标",
    "下一场景": "G10",
    "存档点": "AUTO-G09-010",
    "关键道具": "禁区旗",
    "危险ID": "无",
    "UI引用": "UI-075"
  }
]