[
  {
    "场景ID": "SCN-G03-00",
    "场景名称": "落货码头的空箱",
    "地点": "落货码头",
    "场景类型": "入场救援",
    "角色": "星宇、七码、卡卡",
    "核心目标": "救下卡卡并确认反向传送带异常",
    "下一场景": "SCN-G03-01",
    "存档点": "AUTO-G03-001",
    "关键道具": "磁力手套",
    "危险ID": "DANGER-007",
    "UI引用": "UI-005"
  },
  {
    "场景ID": "SCN-G03-01",
    "场景名称": "平均分配引发的争斗",
    "地点": "四工坊仓库门前",
    "场景类型": "需求调查",
    "角色": "星宇、七码、方盒姨、四工匠",
    "核心目标": "识别平均分配导致的真实缺口",
    "下一场景": "SCN-G03-02",
    "存档点": "AUTO-G03-002",
    "关键道具": "需求卡、库存标签",
    "危险ID": "DANGER-008",
    "UI引用": "UI-016"
  },
  {
    "场景ID": "SCN-G03-02",
    "场景名称": "会吃人的缺口宴席",
    "地点": "缺口宴席台",
    "场景类型": "规则核验",
    "角色": "星宇、七码、四工匠、饕餮",
    "核心目标": "证明四区需求不相同并建立需求表",
    "下一场景": "SCN-G03-03",
    "存档点": "AUTO-G03-003",
    "关键道具": "真实需求表",
    "危险ID": "DANGER-009",
    "UI引用": "UI-016/UI-062"
  },
  {
    "场景ID": "SCN-G03-03",
    "场景名称": "标签全错的第一腹仓",
    "地点": "饕餮第一腹仓",
    "场景类型": "找物与分类",
    "角色": "星宇、七码、卡卡",
    "核心目标": "恢复货箱真实归属与运输目标",
    "下一场景": "SCN-G03-04",
    "存档点": "AUTO-G03-004",
    "关键道具": "货箱标签、急救弹簧",
    "危险ID": "DANGER-010",
    "UI引用": "UI-017"
  },
  {
    "场景ID": "SCN-G03-04",
    "场景名称": "伪造超级订单",
    "地点": "移动印刷台",
    "场景类型": "文书取证",
    "角色": "星宇、七码",
    "核心目标": "恢复订单改写层并制作干扰订单",
    "下一场景": "SCN-G03-05",
    "存档点": "AUTO-G03-005",
    "关键道具": "订单原稿、印章片、油墨滚轮",
    "危险ID": "DANGER-011",
    "UI引用": "UI-017"
  },
  {
    "场景ID": "SCN-G03-05",
    "场景名称": "腹仓收缩安全撤离",
    "地点": "饕餮三层腹仓",
    "场景类型": "时间窗口路线",
    "角色": "星宇、七码、卡卡",
    "核心目标": "在闭合窗口中转移人员和关键货箱",
    "下一场景": "SCN-G03-06",
    "存档点": "AUTO-G03-006",
    "关键道具": "导向齿轮、紧急分流柄",
    "危险ID": "DANGER-012",
    "UI引用": "UI-018"
  },
  {
    "场景ID": "SCN-G03-06",
    "场景名称": "传送带逆行修复",
    "地点": "中央输送脊柱",
    "场景类型": "机制维修",
    "角色": "星宇、七码、方盒姨",
    "核心目标": "调整齿轮、带速和分流门恢复物流",
    "下一场景": "SCN-G03-07",
    "存档点": "AUTO-G03-007",
    "关键道具": "传动齿轮、保险销",
    "危险ID": "DANGER-013",
    "UI引用": "UI-018"
  },
  {
    "场景ID": "SCN-G03-07",
    "场景名称": "管理员权限解除",
    "地点": "饕餮控制室",
    "场景类型": "综合权限核验",
    "角色": "星宇、七码、四工匠、方盒姨、饕餮",
    "核心目标": "以需求、订单、运输和公开分配解除控制",
    "下一场景": "SCN-G03-08",
    "存档点": "AUTO-G03-008",
    "关键道具": "全部关键证据",
    "危险ID": "DANGER-008/011/013",
    "UI引用": "UI-062"
  },
  {
    "场景ID": "SCN-G03-08",
    "场景名称": "第一次公开分配会",
    "地点": "中央仓库大厅",
    "场景类型": "资源协商",
    "角色": "星宇、七码、方盒姨、四工匠、居民",
    "核心目标": "完成最低保障、生产需求和储备分配",
    "下一场景": "SCN-G03-09",
    "存档点": "AUTO-G03-009",
    "关键道具": "资源块、需求表",
    "危险ID": "无",
    "UI引用": "UI-019"
  },
  {
    "场景ID": "SCN-G03-09",
    "场景名称": "归还与结算",
    "地点": "四工坊与码头",
    "场景类型": "回访结算",
    "角色": "星宇、七码、卡卡、饕餮",
    "核心目标": "验证生活变化并完成章节结算",
    "下一场景": "G04",
    "存档点": "AUTO-G03-010",
    "关键道具": "借用工具归还",
    "危险ID": "无",
    "UI引用": "UI-063"
  }
]