[
  {
    "场景ID": "SCN-G12-00",
    "场景名称": "失序的工程环",
    "地点": "星环工程港",
    "场景类型": "入场调查",
    "角色": "星宇、七码、项目员序序、接口师接接、质量员复复、女娲",
    "核心目标": "完成失序的工程环的调查、找物、机制或权限目标",
    "下一场景": "SCN-G12-01",
    "存档点": "AUTO-G12-001",
    "关键道具": "工序任务卡",
    "危险ID": "DANGER-062",
    "UI引用": "UI-052"
  },
  {
    "场景ID": "SCN-G12-01",
    "场景名称": "工序依赖网",
    "地点": "项目调度厅",
    "场景类型": "机制推进",
    "角色": "星宇、七码、项目员序序、接口师接接、质量员复复、女娲",
    "核心目标": "完成工序依赖网的调查、找物、机制或权限目标",
    "下一场景": "SCN-G12-02",
    "存档点": "AUTO-G12-002",
    "关键道具": "依赖线扣",
    "危险ID": "DANGER-063",
    "UI引用": "UI-052"
  },
  {
    "场景ID": "SCN-G12-02",
    "场景名称": "跨接口接驳",
    "地点": "多制式接口区",
    "场景类型": "找物与机制",
    "角色": "星宇、七码、项目员序序、接口师接接、质量员复复、女娲",
    "核心目标": "完成跨接口接驳的调查、找物、机制或权限目标",
    "下一场景": "SCN-G12-03",
    "存档点": "AUTO-G12-003",
    "关键道具": "接口规尺",
    "危险ID": "DANGER-064",
    "UI引用": "UI-053"
  },
  {
    "场景ID": "SCN-G12-03",
    "场景名称": "外环风暴",
    "地点": "外环平台",
    "场景类型": "机制推进",
    "角色": "星宇、七码、项目员序序、接口师接接、质量员复复、女娲",
    "核心目标": "完成外环风暴的调查、找物、机制或权限目标",
    "下一场景": "SCN-G12-04",
    "存档点": "AUTO-G12-004",
    "关键道具": "转接环",
    "危险ID": "DANGER-065",
    "UI引用": "UI-053"
  },
  {
    "场景ID": "SCN-G12-04",
    "场景名称": "姿态稳定窗",
    "地点": "姿态控制舱",
    "场景类型": "找物与机制",
    "角色": "星宇、七码、项目员序序、接口师接接、质量员复复、女娲",
    "核心目标": "完成姿态稳定窗的调查、找物、机制或权限目标",
    "下一场景": "SCN-G12-05",
    "存档点": "AUTO-G12-005",
    "关键道具": "针脚图",
    "危险ID": "DANGER-066",
    "UI引用": "UI-054"
  },
  {
    "场景ID": "SCN-G12-05",
    "场景名称": "质量缺口",
    "地点": "质量档案室",
    "场景类型": "剧情性失败/修正",
    "角色": "星宇、七码、项目员序序、接口师接接、质量员复复、女娲",
    "核心目标": "完成质量缺口的调查、找物、机制或权限目标",
    "下一场景": "SCN-G12-06",
    "存档点": "AUTO-G12-006",
    "关键道具": "负载牌",
    "危险ID": "DANGER-067",
    "UI引用": "UI-054"
  },
  {
    "场景ID": "SCN-G12-06",
    "场景名称": "复核闭环",
    "地点": "复检平台",
    "场景类型": "机制推进",
    "角色": "星宇、七码、项目员序序、接口师接接、质量员复复、女娲",
    "核心目标": "完成复核闭环的调查、找物、机制或权限目标",
    "下一场景": "SCN-G12-07",
    "存档点": "AUTO-G12-007",
    "关键道具": "稳定翼控制片",
    "危险ID": "DANGER-067",
    "UI引用": "UI-055"
  },
  {
    "场景ID": "SCN-G12-07",
    "场景名称": "女娲权限解除",
    "地点": "女娲核心",
    "场景类型": "管理员权限解除",
    "角色": "星宇、七码、项目员序序、接口师接接、质量员复复、女娲",
    "核心目标": "完成女娲权限解除的调查、找物、机制或权限目标",
    "下一场景": "SCN-G12-08",
    "存档点": "AUTO-G12-008",
    "关键道具": "水平仪芯",
    "危险ID": "DANGER-065/DANGER-066/DANGER-067",
    "UI引用": "UI-080"
  },
  {
    "场景ID": "SCN-G12-08",
    "场景名称": "星环恢复",
    "地点": "供能主环",
    "场景类型": "世界改变/回访",
    "角色": "星宇、七码、项目员序序、接口师接接、质量员复复、女娲",
    "核心目标": "完成星环恢复的调查、找物、机制或权限目标",
    "下一场景": "SCN-G12-09",
    "存档点": "AUTO-G12-009",
    "关键道具": "缺陷记录",
    "危险ID": "无",
    "UI引用": "UI-081"
  },
  {
    "场景ID": "SCN-G12-09",
    "场景名称": "回访与结算",
    "地点": "工程纪念廊",
    "场景类型": "世界改变/回访",
    "角色": "星宇、七码、项目员序序、接口师接接、质量员复复、女娲",
    "核心目标": "完成回访与结算的调查、找物、机制或权限目标",
    "下一场景": "G13",
    "存档点": "AUTO-G12-010",
    "关键道具": "维修记录",
    "危险ID": "无",
    "UI引用": "UI-081"
  }
]